============================= test session starts =============================
platform win32 -- Python 3.11.0, pytest-7.4.2, pluggy-1.6.0
benchmark: 5.1.0 (defaults: timer=time.perf_counter disable_gc=False min_rounds=5 min_time=0.000005 max_time=1.0 calibration_precision=10 warmup=False warmup_iterations=100000)
rootdir: C:\gemini-desktop\Ult\backend
plugins: anyio-4.9.0, dash-3.1.1, Faker-37.5.3, logfire-4.0.0, asyncio-0.23.7, benchmark-5.1.0, cov-4.1.0, mock-3.14.1, timeout-2.4.0, xdist-3.8.0, requests-mock-1.12.1, respx-0.22.0, typeguard-4.4.4
asyncio: mode=Mode.STRICT
collected 40 items / 12 errors

=================================== ERRORS ====================================
______________ ERROR collecting src/test_walkforward_lightgbm.py ______________
ImportError while importing test module 'C:\gemini-desktop\Ult\backend\src\test_walkforward_lightgbm.py'.
Hint: make sure your test modules/packages have valid Python names.
Traceback:
C:\Users\neoen\AppData\Local\Programs\Python\Python311\Lib\importlib\__init__.py:126: in import_module
    return _bootstrap._gcd_import(name[level:], package, level)
src\__init__.py:16: in <module>
    from .api.responses import BaseAPIResponse, success_response, ErrorResponse
src\api\__init__.py:2: in <module>
    from .server import create_app, get_app
src\api\server.py:36: in <module>
    from src.api.routers import (
src\api\routers\__init__.py:3: in <module>
    from . import trading
src\api\routers\trading.py:10: in <module>
    from src.services.trading_service import TradingService
src\services\trading_service.py:8: in <module>
    from src.data.data_loader import fetch_stock_data, get_latest_price
E   ModuleNotFoundError: No module named 'src.data.data_loader'
____________________ ERROR collecting tests/test_agents.py ____________________
ImportError while importing test module 'C:\gemini-desktop\Ult\backend\tests\test_agents.py'.
Hint: make sure your test modules/packages have valid Python names.
Traceback:
C:\Users\neoen\AppData\Local\Programs\Python\Python311\Lib\importlib\__init__.py:126: in import_module
    return _bootstrap._gcd_import(name[level:], package, level)
tests\test_agents.py:3: in <module>
    from src.core.agent_loop import AutonomousAgent
src\core\agent_loop.py:10: in <module>
    from src.api.websocket_manager import manager as ws_manager
src\api\__init__.py:2: in <module>
    from .server import create_app, get_app
src\api\server.py:36: in <module>
    from src.api.routers import (
src\api\routers\__init__.py:3: in <module>
    from . import trading
src\api\routers\trading.py:10: in <module>
    from src.services.trading_service import TradingService
src\services\trading_service.py:8: in <module>
    from src.data.data_loader import fetch_stock_data, get_latest_price
E   ModuleNotFoundError: No module named 'src.data.data_loader'
________________ ERROR collecting tests/test_api_endpoints.py _________________
ImportError while importing test module 'C:\gemini-desktop\Ult\backend\tests\test_api_endpoints.py'.
Hint: make sure your test modules/packages have valid Python names.
Traceback:
C:\Users\neoen\AppData\Local\Programs\Python\Python311\Lib\importlib\__init__.py:126: in import_module
    return _bootstrap._gcd_import(name[level:], package, level)
tests\test_api_endpoints.py:4: in <module>
    from src.api.server import create_app
src\api\__init__.py:2: in <module>
    from .server import create_app, get_app
src\api\server.py:36: in <module>
    from src.api.routers import (
src\api\routers\__init__.py:3: in <module>
    from . import trading
src\api\routers\trading.py:10: in <module>
    from src.services.trading_service import TradingService
src\services\trading_service.py:8: in <module>
    from src.data.data_loader import fetch_stock_data, get_latest_price
E   ModuleNotFoundError: No module named 'src.data.data_loader'
_______________ ERROR collecting tests/test_api_integration.py ________________
ImportError while importing test module 'C:\gemini-desktop\Ult\backend\tests\test_api_integration.py'.
Hint: make sure your test modules/packages have valid Python names.
Traceback:
C:\Users\neoen\AppData\Local\Programs\Python\Python311\Lib\importlib\__init__.py:126: in import_module
    return _bootstrap._gcd_import(name[level:], package, level)
tests\test_api_integration.py:12: in <module>
    from src.api.server import create_app
src\api\__init__.py:2: in <module>
    from .server import create_app, get_app
src\api\server.py:36: in <module>
    from src.api.routers import (
src\api\routers\__init__.py:3: in <module>
    from . import trading
src\api\routers\trading.py:10: in <module>
    from src.services.trading_service import TradingService
src\services\trading_service.py:8: in <module>
    from src.data.data_loader import fetch_stock_data, get_latest_price
E   ModuleNotFoundError: No module named 'src.data.data_loader'
________________ ERROR collecting tests/test_api_structure.py _________________
ImportError while importing test module 'C:\gemini-desktop\Ult\backend\tests\test_api_structure.py'.
Hint: make sure your test modules/packages have valid Python names.
Traceback:
C:\Users\neoen\AppData\Local\Programs\Python\Python311\Lib\importlib\__init__.py:126: in import_module
    return _bootstrap._gcd_import(name[level:], package, level)
tests\test_api_structure.py:12: in <module>
    from src.api_server import get_app
E   ModuleNotFoundError: No module named 'src.api_server'
_________________ ERROR collecting tests/test_auto_trader.py __________________
ImportError while importing test module 'C:\gemini-desktop\Ult\backend\tests\test_auto_trader.py'.
Hint: make sure your test modules/packages have valid Python names.
Traceback:
C:\Users\neoen\AppData\Local\Programs\Python\Python311\Lib\importlib\__init__.py:126: in import_module
    return _bootstrap._gcd_import(name[level:], package, level)
tests\test_auto_trader.py:10: in <module>
    from src.auto_trader import AutoTrader
src\auto_trader.py:11: in <module>
    from .data.data_loader import fetch_stock_data, get_latest_price
E   ModuleNotFoundError: No module named 'src.data.data_loader'
____________________ ERROR collecting tests/test_chaos.py _____________________
ImportError while importing test module 'C:\gemini-desktop\Ult\backend\tests\test_chaos.py'.
Hint: make sure your test modules/packages have valid Python names.
Traceback:
C:\Users\neoen\AppData\Local\Programs\Python\Python311\Lib\importlib\__init__.py:126: in import_module
    return _bootstrap._gcd_import(name[level:], package, level)
tests\test_chaos.py:10: in <module>
    from src.portfolio_manager import PortfolioManager
src\portfolio_manager.py:5: in <module>
    from src.data_temp.data_loader import fetch_stock_data, fetch_realtime_data
E   ModuleNotFoundError: No module named 'src.data_temp.data_loader'
_____________ ERROR collecting tests/test_continuous_learning.py ______________
ImportError while importing test module 'C:\gemini-desktop\Ult\backend\tests\test_continuous_learning.py'.
Hint: make sure your test modules/packages have valid Python names.
Traceback:
C:\Users\neoen\AppData\Local\Programs\Python\Python311\Lib\importlib\__init__.py:126: in import_module
    return _bootstrap._gcd_import(name[level:], package, level)
tests\test_continuous_learning.py:12: in <module>
    from backend.src.continuous_learning import (
E   ModuleNotFoundError: No module named 'backend'
_________________ ERROR collecting tests/test_learning_api.py _________________
ImportError while importing test module 'C:\gemini-desktop\Ult\backend\tests\test_learning_api.py'.
Hint: make sure your test modules/packages have valid Python names.
Traceback:
C:\Users\neoen\AppData\Local\Programs\Python\Python311\Lib\importlib\__init__.py:126: in import_module
    return _bootstrap._gcd_import(name[level:], package, level)
tests\test_learning_api.py:11: in <module>
    from backend.src.api.routers.learning import router
E   ModuleNotFoundError: No module named 'backend'
__________________ ERROR collecting tests/test_websocket.py ___________________
ImportError while importing test module 'C:\gemini-desktop\Ult\backend\tests\test_websocket.py'.
Hint: make sure your test modules/packages have valid Python names.
Traceback:
C:\Users\neoen\AppData\Local\Programs\Python\Python311\Lib\importlib\__init__.py:126: in import_module
    return _bootstrap._gcd_import(name[level:], package, level)
tests\test_websocket.py:9: in <module>
    from src.api.server import create_app
src\api\__init__.py:2: in <module>
    from .server import create_app, get_app
src\api\server.py:36: in <module>
    from src.api.routers import (
src\api\routers\__init__.py:3: in <module>
    from . import trading
src\api\routers\trading.py:10: in <module>
    from src.services.trading_service import TradingService
src\services\trading_service.py:8: in <module>
    from src.data.data_loader import fetch_stock_data, get_latest_price
E   ModuleNotFoundError: No module named 'src.data.data_loader'
_______________ ERROR collecting tests/core/test_agent_loop.py ________________
ImportError while importing test module 'C:\gemini-desktop\Ult\backend\tests\core\test_agent_loop.py'.
Hint: make sure your test modules/packages have valid Python names.
Traceback:
C:\Users\neoen\AppData\Local\Programs\Python\Python311\Lib\importlib\__init__.py:126: in import_module
    return _bootstrap._gcd_import(name[level:], package, level)
tests\core\test_agent_loop.py:17: in <module>
    from src.core.agent_loop import AutonomousAgent
src\core\agent_loop.py:11: in <module>
    from src.services.approval_service import ApprovalService
src\services\approval_service.py:8: in <module>
    from src.api.websocket_types import (
src\api\__init__.py:2: in <module>
    from .server import create_app, get_app
src\api\server.py:36: in <module>
    from src.api.routers import (
src\api\routers\__init__.py:3: in <module>
    from . import trading
src\api\routers\trading.py:10: in <module>
    from src.services.trading_service import TradingService
src\services\trading_service.py:8: in <module>
    from src.data.data_loader import fetch_stock_data, get_latest_price
E   ModuleNotFoundError: No module named 'src.data.data_loader'
__________ ERROR collecting tests/services/test_approval_service.py ___________
ImportError while importing test module 'C:\gemini-desktop\Ult\backend\tests\services\test_approval_service.py'.
Hint: make sure your test modules/packages have valid Python names.
Traceback:
C:\Users\neoen\AppData\Local\Programs\Python\Python311\Lib\importlib\__init__.py:126: in import_module
    return _bootstrap._gcd_import(name[level:], package, level)
tests\services\test_approval_service.py:4: in <module>
    from src.services.approval_service import ApprovalService
src\services\approval_service.py:8: in <module>
    from src.api.websocket_types import (
src\api\__init__.py:2: in <module>
    from .server import create_app, get_app
src\api\server.py:36: in <module>
    from src.api.routers import (
src\api\routers\__init__.py:3: in <module>
    from . import trading
src\api\routers\trading.py:10: in <module>
    from src.services.trading_service import TradingService
src\services\trading_service.py:8: in <module>
    from src.data.data_loader import fetch_stock_data, get_latest_price
E   ModuleNotFoundError: No module named 'src.data.data_loader'
============================== warnings summary ===============================
..\..\..\Users\neoen\AppData\Local\Programs\Python\Python311\Lib\site-packages\pydantic\fields.py:1093
..\..\..\Users\neoen\AppData\Local\Programs\Python\Python311\Lib\site-packages\pydantic\fields.py:1093
  C:\Users\neoen\AppData\Local\Programs\Python\Python311\Lib\site-packages\pydantic\fields.py:1093: PydanticDeprecatedSince20: Using extra keyword arguments on `Field` is deprecated and will be removed. Use `json_schema_extra` instead. (Extra keys: 'env'). Deprecated in Pydantic V2.0 to be removed in V3.0. See Pydantic V2 Migration Guide at https://errors.pydantic.dev/2.11/migration/
    warn(

..\..\..\Users\neoen\AppData\Local\Programs\Python\Python311\Lib\site-packages\pydantic\_internal\_config.py:323
  C:\Users\neoen\AppData\Local\Programs\Python\Python311\Lib\site-packages\pydantic\_internal\_config.py:323: PydanticDeprecatedSince20: Support for class-based `config` is deprecated, use ConfigDict instead. Deprecated in Pydantic V2.0 to be removed in V3.0. See Pydantic V2 Migration Guide at https://errors.pydantic.dev/2.11/migration/
    warnings.warn(DEPRECATION_MESSAGE, DeprecationWarning)

..\..\..\Users\neoen\AppData\Local\Programs\Python\Python311\Lib\site-packages\pydantic\_internal\_generate_schema.py:298
..\..\..\Users\neoen\AppData\Local\Programs\Python\Python311\Lib\site-packages\pydantic\_internal\_generate_schema.py:298
..\..\..\Users\neoen\AppData\Local\Programs\Python\Python311\Lib\site-packages\pydantic\_internal\_generate_schema.py:298
..\..\..\Users\neoen\AppData\Local\Programs\Python\Python311\Lib\site-packages\pydantic\_internal\_generate_schema.py:298
..\..\..\Users\neoen\AppData\Local\Programs\Python\Python311\Lib\site-packages\pydantic\_internal\_generate_schema.py:298
  C:\Users\neoen\AppData\Local\Programs\Python\Python311\Lib\site-packages\pydantic\_internal\_generate_schema.py:298: PydanticDeprecatedSince20: `json_encoders` is deprecated. See https://docs.pydantic.dev/2.11/concepts/serialization/#custom-serializers for alternatives. Deprecated in Pydantic V2.0 to be removed in V3.0. See Pydantic V2 Migration Guide at https://errors.pydantic.dev/2.11/migration/
    warnings.warn(

-- Docs: https://docs.pytest.org/en/stable/how-to/capture-warnings.html
=========================== short test summary info ===========================
ERROR src/test_walkforward_lightgbm.py
ERROR tests/test_agents.py
ERROR tests/test_api_endpoints.py
ERROR tests/test_api_integration.py
ERROR tests/test_api_structure.py
ERROR tests/test_auto_trader.py
ERROR tests/test_chaos.py
ERROR tests/test_continuous_learning.py
ERROR tests/test_learning_api.py
ERROR tests/test_websocket.py
ERROR tests/core/test_agent_loop.py
ERROR tests/services/test_approval_service.py
!!!!!!!!!!!!!!!!!! Interrupted: 12 errors during collection !!!!!!!!!!!!!!!!!!!
======================= 8 warnings, 12 errors in 2.53s ========================
